{
  "schema_name": "StreamContext",
  "schema_version": "1.0.0",
  "id": "01JH7Y0J1S0J2R1K9F1Y2YQZ9A",
  "ts": "2025-12-12T20:15:05.123Z",
  "room_id": "room:demo",
  "sequence": 0,
  "transcript_window": [],
  "events": [],
  "keywords": ["idle", "setup"],
  "summary": "Stream is live; no recent speech detected."
}
